{
  "report_id": "DQR-20260320",
  "target_date": "20260320",
  "generated_at": "2026-03-22T13:24:28+09:00",
  "dmp": {
    "stats": {
      "ticker_count": 26,
      "market_data_count": 26,
      "news_count": 78,
      "disclosure_count": 100,
      "missing_tickers": [],
      "stale_tickers": [],
      "null_mktcap_count": 26,
      "empty_tech_count": 0,
      "null_macro_fields": [
        "vix_proxy",
        "market_breadth"
      ],
      "duplicate_news": 21
    },
    "issues": [
      "시가총액 null 종목: 26개 (pykrx 호환 이슈)",
      "매크로 데이터 null: ['vix_proxy', 'market_breadth']",
      "뉴스 evidence_id 중복: 21건"
    ],
    "pass": false
  },
  "ttp": {
    "stats": {
      "pack_count": 3,
      "total_docs": 48,
      "avg_dedup_ratio": 1.0,
      "empty_packs": []
    },
    "issues": [],
    "pass": true
  },
  "overall_pass": false
}